{
  "$schema": "http://json-schema.org/draft-07/schema#",
  "title": "standards.json — the external competency spine and its crosswalk",
  "type": "object",
  "required": ["schemaVersion", "frameworks", "units"],
  "additionalProperties": false,
  "properties": {
    "schemaVersion": { "const": 1 },
    "_note": { "type": "string" },
    "frameworks": {
      "type": "array",
      "minItems": 1,
      "items": { "$ref": "#/definitions/framework" }
    },
    "units": {
      "type": "array",
      "minItems": 1,
      "items": { "$ref": "#/definitions/unit" }
    }
  },
  "definitions": {
    "framework": {
      "type": "object",
      "required": ["key", "name", "version", "versionDate", "authority", "rights"],
      "additionalProperties": false,
      "properties": {
        "key": { "type": "string", "pattern": "^[a-z0-9][a-z0-9-]*$" },
        "name": { "type": "string", "minLength": 8 },
        "version": { "type": "string", "minLength": 3 },
        "versionDate": { "type": "string", "pattern": "^\\d{4}-\\d{2}-\\d{2}$" },
        "authority": { "type": "string", "minLength": 3 },
        "sourceUrl": { "type": "string", "pattern": "^https://" },
        "note": { "type": "string" },
        "rights": { "$ref": "#/definitions/rights" }
      }
    },
    "rights": {
      "type": "object",
      "description": "Whether this framework's identifiers and unit titles may be reproduced here. Deliberately mirrors the instrument_rights.json posture: a grant is quoted verbatim and captured with a date, never summarised, because a permission sentence on a web page can change without notice.",
      "required": ["status", "verifiedOn"],
      "additionalProperties": false,
      "properties": {
        "status": {
          "enum": ["granted", "not-established", "restricted", "retired"],
          "description": "granted means an affirmative third-party educational grant was located and quoted. not-established means no grant was found — which is NOT the same as no grant existing, and must not be treated as a refusal."
        },
        "grantText": {
          "type": "string",
          "minLength": 20,
          "description": "The permission language VERBATIM. Required when status is granted."
        },
        "sourceUrl": { "type": "string", "pattern": "^https://" },
        "verifiedOn": { "type": "string", "pattern": "^\\d{4}-\\d{2}-\\d{2}$" },
        "verifiedVia": { "type": "string", "minLength": 8 },
        "archivedCopy": {
          "type": "string",
          "minLength": 3,
          "description": "Repo-relative path to a dated capture of the permission page. Required when status is granted — this, not the live URL, is the record of what the source said."
        },
        "titlesReproducible": {
          "type": "boolean",
          "description": "May this framework's unit TITLES be shown verbatim on a shipped page? False forces reference mode: cite the identifier, paraphrase the title."
        },
        "pendingQuestion": { "type": "string" }
      },
      "allOf": [
        {
          "if": { "properties": { "status": { "const": "granted" } } },
          "then": { "required": ["grantText", "archivedCopy", "sourceUrl", "titlesReproducible"] }
        }
      ]
    },
    "unit": {
      "type": "object",
      "required": ["id", "framework", "code", "title", "domain", "rotationRequirement", "review"],
      "additionalProperties": false,
      "properties": {
        "id": { "type": "string", "pattern": "^[a-z0-9][a-z0-9.-]*$" },
        "framework": { "type": "string", "pattern": "^[a-z0-9][a-z0-9-]*$" },
        "code": { "type": "string", "minLength": 2 },
        "title": { "type": "string", "minLength": 4 },
        "domain": { "type": "string", "minLength": 2 },
        "rotationRequirement": {
          "enum": ["required", "elsewhere", "undecided"],
          "description": "For the 4-week adult inpatient resident rotation only. 'elsewhere' means the program addresses it on a different rotation and this one is correctly silent — that is a coverage ANSWER, not a gap."
        },
        "rotationRationale": { "type": "string", "minLength": 10 },
        "internalCodes": {
          "type": "array",
          "items": { "type": "string", "pattern": "^[a-z][a-z-]*$" },
          "description": "Mapped internal content codes. An EMPTY array is meaningful and is not a defect on its own — but it is not automatically innocent either. Every unit with an empty array must declare a mappingStatus saying WHICH kind of empty it is; bin/check_standards_coverage.py refuses an unexplained one and reports the three kinds separately."
        },
        "mappingStatus": {
          "enum": ["answered-elsewhere", "blocked-on-vocabulary", "category-mismatch"],
          "description": "REQUIRED when internalCodes is empty, and FORBIDDEN when it is not. Why this unit maps to nothing. `answered-elsewhere`: the rotation does not teach it, so silence here is the answer. `blocked-on-vocabulary`: mappable the day a named code is added or split — a REAL content gap, and mappingBlockedBy must name the missing code. `category-mismatch`: genuinely inexpressible in a disorder taxonomy, for all time — deliberately hard to earn and currently unused, so check first whether the unit is really just blocked on a code nobody has written. Added 2026-09-14 because a single report line was calling all ten unmapped units 'not a content gap' while nine of them carried notes reading 'VOCABULARY GAP'."
        },
        "mappingBlockedBy": {
          "type": "string",
          "minLength": 10,
          "description": "REQUIRED when mappingStatus is 'blocked-on-vocabulary'. The code that does not exist yet, in words — e.g. 'no psychotherapy code exists in the twelve-code vocabulary'. A gap nobody named is a gap nobody fixes, so the checker will not accept the status without it."
        },
        "mappingNote": { "type": "string" },
        "review": {
          "enum": ["pending", "approved", "rejected"],
          "description": "Faculty review of this unit's rotation requirement and mapping. Nothing here is publishable while pending."
        },
        "reviewedBy": { "type": "string" },
        "reviewedOn": { "type": "string", "pattern": "^\\d{4}-\\d{2}-\\d{2}$" }
      }
    }
  }
}
